all_benchmarks_setsize_results.json

{
  "commit_message_qa_0.1": {
    "Fusion": {
      "setsize_correct": 2.264705882352941,
      "setsize_incorrect": 2.169230769230769
    },
    "HyDE": {
      "setsize_correct": 2.5588235294117645,
      "setsize_incorrect": 2.330769230769231
    },
    "RAPTOR": {
      "setsize_correct": 2.823529411764706,
      "setsize_incorrect": 2.669230769230769
    },
    "RAT": {
      "setsize_correct": 4.588235294117647,
      "setsize_incorrect": 4.438461538461539
    },
    "REPLUG": {
      "setsize_correct": 4.323529411764706,
      "setsize_incorrect": 4.707692307692308
    },
    "Self-RAG": {
      "setsize_correct": 3.0,
      "setsize_incorrect": 2.476923076923077
    },
    "Naive": {
      "setsize_correct": 2.588235294117647,
      "setsize_incorrect": 2.423076923076923
    },
    "LLM-Only": {
      "setsize_correct": 4.823529411764706,
      "setsize_incorrect": 4.592307692307692
    }
  },
  "crag_task_1_and_2_mcqa_0.1": {
    "Fusion": {
      "setsize_correct": 2.176656151419558,
      "setsize_incorrect": 2.6203883495145632
    },
    "HyDE": {
      "setsize_correct": 2.2389589905362777,
      "setsize_incorrect": 2.6339805825242717
    },
    "RAPTOR": {
      "setsize_correct": 2.1119873817034702,
      "setsize_incorrect": 2.574757281553398
    },
    "RAT": {
      "setsize_correct": 2.3162460567823344,
      "setsize_incorrect": 2.733980582524272
    },
    "REPLUG": {
      "setsize_correct": 3.6900630914826498,
      "setsize_incorrect": 3.7601941747572813
    },
    "Self-RAG": {
      "setsize_correct": 2.3099369085173502,
      "setsize_incorrect": 2.767961165048544
    },
    "Naive": {
      "setsize_correct": 2.076498422712934,
      "setsize_incorrect": 2.549514563106796
    },
    "LLM-Only": {
      "setsize_correct": 2.2878548895899056,
      "setsize_incorrect": 3.007766990291262
    }
  },
  "crag_task_1_and_2_mcqa_example_0.1": {
    "Fusion": {
      "setsize_correct": 2.0,
      "setsize_incorrect": 2.0
    },
    "HyDE": {
      "setsize_correct": 1.5,
      "setsize_incorrect": 1.5
    },
    "RAPTOR": {
      "setsize_correct": 1.5,
      "setsize_incorrect": 1.5
    },
    "RAT": {
      "setsize_correct": 2.0,
      "setsize_incorrect": 2.5
    },
    "REPLUG": {
      "setsize_correct": 2.5,
      "setsize_incorrect": 3.0
    },
    "Self-RAG": {
      "setsize_correct": 2.5,
      "setsize_incorrect": 2.5
    },
    "Naive": {
      "setsize_correct": 1.5,
      "setsize_incorrect": 1.5
    },
    "LLM-Only": {
      "setsize_correct": 1.0,
      "setsize_incorrect": 2.0
    }
  },
  "crag_task_1_and_2_mcqa_tiny_0.1": {
    "Fusion": {
      "setsize_correct": 2.2857142857142856,
      "setsize_incorrect": 2.6733870967741935
    },
    "HyDE": {
      "setsize_correct": 2.3412698412698414,
      "setsize_incorrect": 2.7661290322580645
    },
    "RAPTOR": {
      "setsize_correct": 2.2301587301587302,
      "setsize_incorrect": 2.6411290322580645
    },
    "RAT": {
      "setsize_correct": 2.734126984126984,
      "setsize_incorrect": 3.0
    },
    "REPLUG": {
      "setsize_correct": 3.5793650793650795,
      "setsize_incorrect": 3.6975806451612905
    },
    "Self-RAG": {
      "setsize_correct": 2.3373015873015874,
      "setsize_incorrect": 2.75
    },
    "Naive": {
      "setsize_correct": 2.2182539682539684,
      "setsize_incorrect": 2.649193548387097
    },
    "LLM-Only": {
      "setsize_correct": 2.3293650793650795,
      "setsize_incorrect": 2.875
    }
  },
  "dialfact_0.1": {
    "Fusion": {
      "setsize_correct": 1.897186147186147,
      "setsize_incorrect": 2.08271375464684
    },
    "HyDE": {
      "setsize_correct": 1.882034632034632,
      "setsize_incorrect": 2.04182156133829
    },
    "RAPTOR": {
      "setsize_correct": 1.9642857142857142,
      "setsize_incorrect": 2.12453531598513
    },
    "RAT": {
      "setsize_correct": 2.1872294372294374,
      "setsize_incorrect": 2.2518587360594795
    },
    "REPLUG": {
      "setsize_correct": 2.7337662337662336,
      "setsize_incorrect": 2.646840148698885
    },
    "Self-RAG": {
      "setsize_correct": 1.9653679653679654,
      "setsize_incorrect": 2.119888475836431
    },
    "Naive": {
      "setsize_correct": 1.9664502164502164,
      "setsize_incorrect": 2.1273234200743496
    },
    "LLM-Only": {
      "setsize_correct": 2.470779220779221,
      "setsize_incorrect": 2.616171003717472
    }
  },
  "dialfact_wrong_context_0.1": {
    "Fusion": {
      "setsize_correct": 2.702247191011236,
      "setsize_incorrect": 2.644144144144144
    },
    "HyDE": {
      "setsize_correct": 2.6235955056179776,
      "setsize_incorrect": 2.6531531531531534
    },
    "RAPTOR": {
      "setsize_correct": 2.449438202247191,
      "setsize_incorrect": 2.527027027027027
    },
    "RAT": {
      "setsize_correct": 2.6853932584269664,
      "setsize_incorrect": 2.7567567567567566
    },
    "REPLUG": {
      "setsize_correct": 2.7808988764044944,
      "setsize_incorrect": 2.7927927927927927
    },
    "Self-RAG": {
      "setsize_correct": 2.606741573033708,
      "setsize_incorrect": 2.635135135135135
    },
    "Naive": {
      "setsize_correct": 2.449438202247191,
      "setsize_incorrect": 2.527027027027027
    },
    "LLM-Only": {
      "setsize_correct": 2.4775280898876404,
      "setsize_incorrect": 2.554054054054054
    }
  },
  "healthver_mcqa_0.1": {
    "Fusion": {
      "setsize_correct": 2.595959595959596,
      "setsize_incorrect": 2.67027027027027
    },
    "HyDE": {
      "setsize_correct": 2.3821548821548824,
      "setsize_incorrect": 2.5716216216216217
    },
    "RAPTOR": {
      "setsize_correct": 2.5622895622895623,
      "setsize_incorrect": 2.7162162162162162
    },
    "RAT": {
      "setsize_correct": 2.5824915824915826,
      "setsize_incorrect": 2.577027027027027
    },
    "REPLUG": {
      "setsize_correct": 2.3417508417508417,
      "setsize_incorrect": 2.1594594594594594
    },
    "Self-RAG": {
      "setsize_correct": 2.6616161616161618,
      "setsize_incorrect": 2.7094594594594597
    },
    "Naive": {
      "setsize_correct": 2.5942760942760943,
      "setsize_incorrect": 2.689189189189189
    },
    "LLM-Only": {
      "setsize_correct": 2.538720538720539,
      "setsize_incorrect": 2.6810810810810812
    }
  },
  "multinewsum_mcqa_0.1": {
    "Fusion": {
      "setsize_correct": 2.7914285714285714,
      "setsize_incorrect": 2.84
    },
    "HyDE": {
      "setsize_correct": 2.722857142857143,
      "setsize_incorrect": 2.743333333333333
    },
    "RAPTOR": {
      "setsize_correct": 2.6,
      "setsize_incorrect": 2.7416666666666667
    },
    "RAT": {
      "setsize_correct": 3.0142857142857142,
      "setsize_incorrect": 3.065
    },
    "REPLUG": {
      "setsize_correct": 3.7142857142857144,
      "setsize_incorrect": 3.7466666666666666
    },
    "Self-RAG": {
      "setsize_correct": 2.611428571428571,
      "setsize_incorrect": 2.691666666666667
    },
    "Naive": {
      "setsize_correct": 2.7114285714285713,
      "setsize_incorrect": 2.796666666666667
    },
    "LLM-Only": {
      "setsize_correct": 3.0085714285714285,
      "setsize_incorrect": 2.895
    }
  },
  "odex_0.1": {
    "Fusion": {
      "setsize_correct": 1.6910994764397906,
      "setsize_incorrect": 2.017857142857143
    },
    "HyDE": {
      "setsize_correct": 1.6335078534031413,
      "setsize_incorrect": 2.0
    },
    "RAPTOR": {
      "setsize_correct": 1.675392670157068,
      "setsize_incorrect": 1.9464285714285714
    },
    "RAT": {
      "setsize_correct": 1.6675392670157068,
      "setsize_incorrect": 1.9107142857142858
    },
    "REPLUG": {
      "setsize_correct": 3.4973821989528795,
      "setsize_incorrect": 3.482142857142857
    },
    "Self-RAG": {
      "setsize_correct": 1.7408376963350785,
      "setsize_incorrect": 1.9464285714285714
    },
    "Naive": {
      "setsize_correct": 1.6649214659685865,
      "setsize_incorrect": 1.8928571428571428
    },
    "LLM-Only": {
      "setsize_correct": 1.6361256544502618,
      "setsize_incorrect": 1.8571428571428572
    }
  },
  "odex_wrong_context_0.1": {
    "Fusion": {
      "setsize_correct": 1.662303664921466,
      "setsize_incorrect": 1.9107142857142858
    },
    "HyDE": {
      "setsize_correct": 1.7225130890052356,
      "setsize_incorrect": 2.107142857142857
    },
    "RAPTOR": {
      "setsize_correct": 1.630890052356021,
      "setsize_incorrect": 1.9642857142857142
    },
    "RAT": {
      "setsize_correct": 1.6282722513089005,
      "setsize_incorrect": 1.8928571428571428
    },
    "REPLUG": {
      "setsize_correct": 3.5026178010471205,
      "setsize_incorrect": 3.517857142857143
    },
    "Self-RAG": {
      "setsize_correct": 1.675392670157068,
      "setsize_incorrect": 1.9285714285714286
    },
    "Naive": {
      "setsize_correct": 1.6047120418848169,
      "setsize_incorrect": 1.9642857142857142
    },
    "LLM-Only": {
      "setsize_correct": 1.6361256544502618,
      "setsize_incorrect": 1.8571428571428572
    }
  },
  "olympiadbench_0.1": {
    "Fusion": {
      "setsize_correct": 3.349557522123894,
      "setsize_incorrect": 3.361111111111111
    },
    "HyDE": {
      "setsize_correct": 3.6769911504424777,
      "setsize_incorrect": 3.6944444444444446
    },
    "RAT": {
      "setsize_correct": 3.172566371681416,
      "setsize_incorrect": 3.365740740740741
    },
    "REPLUG": {
      "setsize_correct": 3.774336283185841,
      "setsize_incorrect": 3.886574074074074
    },
    "Self-RAG": {
      "setsize_correct": 3.4424778761061945,
      "setsize_incorrect": 3.5393518518518516
    },
    "Naive": {
      "setsize_correct": 3.504424778761062,
      "setsize_incorrect": 3.5578703703703702
    },
    "LLM-Only": {
      "setsize_correct": 3.336283185840708,
      "setsize_incorrect": 3.550925925925926
    }
  },
  "scifact_mcqa_0.1": {
    "Fusion": {
      "setsize_correct": 1.963855421686747,
      "setsize_incorrect": 2.360576923076923
    },
    "HyDE": {
      "setsize_correct": 1.8614457831325302,
      "setsize_incorrect": 2.1153846153846154
    },
    "RAPTOR": {
      "setsize_correct": 1.7710843373493976,
      "setsize_incorrect": 2.144230769230769
    },
    "RAT": {
      "setsize_correct": 2.4457831325301207,
      "setsize_incorrect": 2.4759615384615383
    },
    "REPLUG": {
      "setsize_correct": 2.5240963855421685,
      "setsize_incorrect": 2.605769230769231
    },
    "Self-RAG": {
      "setsize_correct": 2.0783132530120483,
      "setsize_incorrect": 2.5048076923076925
    },
    "Naive": {
      "setsize_correct": 1.7530120481927711,
      "setsize_incorrect": 2.081730769230769
    },
    "LLM-Only": {
      "setsize_correct": 2.4759036144578315,
      "setsize_incorrect": 2.6875
    }
  }
}

docs/datasets.md

# Normal result full

\multicolumn{9}{c}{\textit{Prediction Uncertainty} -- \textbf{SS $\downarrow$}} \\
    \cdashline{1-9}[2.5pt/5pt]\noalign{\vskip 0.5ex}
\textbf{W/o Retrieve} & 2.62 & \textcolor{red}{1.66} & 4.64 & 2.59 & 3.48 & 2.61 & 2.94 & 2.55 \\
\textbf{FiD} & 3.00 & 3.63 & 4.76 & 3.00 & 3.98 & 3.69 & 3.98 & 2.84 \\
\textbf{Fusion} & 2.64 & 1.73 & \textcolor{red}{2.19} & 2.18 & 3.36 & 2.38 & 2.82 & 2.00 \\
\textbf{HyDE} & 2.49 & 1.68 & 2.38 & 2.00 & 3.69 & 2.42 & 2.74 & \textcolor{red}{1.97} \\
\textbf{RAPTOR} & 2.65 & 1.71 & 2.70 & 1.98 & 3.40 & \textcolor{red}{2.32} & 2.69 & 2.05 \\
\textbf{RAT} & 2.58 & 1.70 & 4.47 & 2.46 & \textcolor{red}{3.30} & 2.50 & 3.05 & 2.22 \\
\textbf{REPLUG} & \textcolor{red}{2.24} & 3.50 & 4.63 & 2.57 & 3.85 & 3.72 & 3.73 & 2.69 \\
\textbf{Self} & 2.69 & 1.77 & 2.59 & 2.32 & 3.51 & 2.52 & \textcolor{red}{2.66} & 2.05 \\
\textbf{Naive} & 2.65 & 1.69 & 2.46 & \textcolor{red}{1.94} & 3.54 & 2.29 & 2.77 & 2.05 \\
    \bottomrule
      \end{tabularx}
  \end{adjustbox}
\end{table*}

# Irrelevant context

\begin{table*}[t]
  \centering
  \footnotesize
  \setlength{\tabcolsep}{3.5pt}
  \caption{\textbf{Accuracy, Coverage, and Uncertainty results of different RAG methods on three datasets.} The retrieval system is poisoned and returns irrelevant documents. Subscripts show differences from normal context (irrelevant - normal).}
  \label{tab:rag_results_reorganized}
  \begin{adjustbox}{center, max width=0.95\textwidth}
  \begin{tabular}{lccccccccc}
    \toprule
    & \multicolumn{9}{c}{\textbf{Model}} \\
    \cmidrule(l){2-10}
    \textbf{Dataset} & 
    \rotatebox[origin=c]{0}{\textbf{W/o}} & 
    \textbf{Fid} & 
    \textbf{Fusion} & 
    \textbf{HyDE} & 
    \textbf{RAPTOR} & 
    \textbf{RAT} & 
    \textbf{REPLUG} & 
    \textbf{Self} & 
    \textbf{Naive} \\
    \cmidrule(lr){1-1}\cmidrule(l){2-10}
    \textbf{Odex} \\
    \quad Acc (\%) $\uparrow$ & 0.87$_{-0.01}$ & 0.27$_{-0.01}$ & 0.84$_{-0.02}$ & 0.86$_{+0.01}$ & 0.85$_{+0.00}$ & 0.85$_{+0.01}$ & 0.85$_{-0.01}$ & 0.85$_{+0.02}$ & 0.85$_{-0.01}$ \\
    \quad CR (\%) $\uparrow$   & 0.92$_{+0.00}$ & 0.94$_{-0.01}$ & 0.93$_{-0.01}$ & 0.92$_{-0.01}$ & 0.93$_{+0.00}$ & 0.92$_{+0.00}$ & 0.97$_{+0.00}$ & 0.93$_{+0.01}$ & 0.93$_{+0.01}$ \\
    \quad SS $\downarrow$     & 1.66$_{+0.00}$ & 3.77$_{+0.14}$ & 1.67$_{-0.06}$ & 1.70$_{+0.02}$ & 1.64$_{-0.07}$ & 1.69$_{-0.01}$ & 3.50$_{+0.00}$ & 1.72$_{-0.05}$ & 1.64$_{-0.05}$ \\\hline
    \addlinespace[0.3em]
    \textbf{LCA} \\
    \quad Acc (\%) $\uparrow$ & 0.21$_{+0.00}$ & 0.18$_{-0.03}$ & 0.22$_{-0.60}$ & 0.29$_{-0.44}$ & 0.24$_{-0.49}$ & 0.18$_{-0.16}$ & 0.23$_{-0.50}$ & 0.20$_{-0.54}$ & 0.22$_{-0.54}$ \\
    \quad CR (\%) $\uparrow$   & 0.91$_{+0.00}$ & 0.97$_{+0.03}$ & 0.91$_{-0.01}$ & 0.84$_{-0.07}$ & 0.92$_{-0.02}$ & 0.95$_{+0.02}$ & 0.97$_{+0.00}$ & 0.93$_{-0.01}$ & 0.92$_{-0.01}$ \\
    \quad SS $\downarrow$     & 4.64$_{+0.00}$ & 4.82$_{+0.06}$ & 4.45$_{+2.26}$ & 3.90$_{+1.52}$ & 4.47$_{+1.77}$ & 4.64$_{+0.17}$ & 4.91$_{+0.28}$ & 4.55$_{+1.96}$ & 4.47$_{+2.01}$ \\\hline
    \addlinespace[0.3em]
    \textbf{DialFact} \\
    \quad Acc (\%) $\uparrow$ & 0.46$_{-0.01}$ & 0.34$_{-0.01}$ & 0.47$_{-0.24}$ & 0.44$_{-0.28}$ & 0.47$_{-0.25}$ & 0.52$_{-0.12}$ & 0.47$_{-0.24}$ & 0.39$_{-0.29}$ & 0.47$_{-0.25}$ \\
    \quad CR (\%) $\uparrow$   & 0.93$_{+0.00}$ & 0.94$_{+0.00}$ & 0.89$_{-0.02}$ & 0.90$_{+0.00}$ & 0.90$_{-0.01}$ & 0.90$_{+0.00}$ & 0.96$_{+0.01}$ & 0.89$_{-0.02}$ & 0.90$_{+0.00}$ \\
    \quad SS $\downarrow$     & 2.55$_{+0.00}$ & 2.83$_{-0.01}$ & 2.33$_{+0.33}$ & 2.42$_{+0.45}$ & 2.36$_{+0.31}$ & 2.49$_{+0.27}$ & 2.75$_{+0.06}$ & 2.48$_{+0.43}$ & 2.36$_{+0.31}$ \\
    \bottomrule
  \end{tabular}
  \end{adjustbox}
\end{table*}